<?xml version="1.0" encoding="utf-8"?>
<Grouter displayName="Router 1" id="grouter_id_1" rmiRegistryPort="1099" rmiServicePort="2000"
         description="Test router for file nodes"
         home="file://temp/grouter"
         xmlns="http://grouter.org/config.xsd"
         xmlns:xsi="http://www.w3.org/2001/XMLSchema-instance"
         xsi:schemaLocation="http://grouter.org/config.xsd ../../../../../../common/common-configbeans/src/main/xsd/config.xsd"
         xsi:noNamespaceSchemaLocation="../../../../../../common/common-configbeans/src/main/xsd/config.xsd">


  <Settings>
    <Jndi>
      <naming.factory.initial>org.jnp.interfaces.NamingContextFactory</naming.factory.initial>
      <naming.provider.url>jnp://localhost:1099</naming.provider.url>
      <naming.factory.url.pkgs>org.jboss.naming:org.jnp.interfaces</naming.factory.url.pkgs>
      <naming.queueconnectionfactoy>UIL2ConnectionFactory</naming.queueconnectionfactoy>
    </Jndi>
    <Logging>
      <jms.loggingQueue>queue/GrouterQueue</jms.loggingQueue>
    </Logging>
    <!-- This overrides datasource set in spring context files -->
    <DataSource>
      <dialect>org.gjt.mm.mysql.Driver</dialect>
      <driverClassName>kjhkjk</driverClassName>
      <url></url>
      <userName></userName>
      <password></password>
    </DataSource>
  </Settings>


  <Nodes>
    <Node id="filetest" createuniquename="true" source="BACARGO_C2K" receiver="C2K">
      <description>blaba albaba</description>
      <displayName>FileTest</displayName>
      <createdOn>2007-01-01</createdOn>
      <modifiedOn>2007-01-01</modifiedOn>
      <backup>
        <overrideDefaultUri>file://temp/grouter/nodes/filetest/backupoverride</overrideDefaultUri>
      </backup>
      <inBoundEndPoint id="filereader_1" endPointType="FILE_READER">
        <uri>file://temp/grouter/nodes/filetest/in</uri>
        <clazzname>a classname</clazzname>
        <cron>0/5 * * * * ?</cron>
      </inBoundEndPoint>
      <outBoundEndPoint id="filewriter_1" endPointType="FILE_WRITER">
        <uri>file://temp/grouter/nodes/filetest/out</uri>
        <clazzname>a classname</clazzname>
        <cron>0/5 * * * * ?</cron>
      </outBoundEndPoint>
    </Node>

    <Node id="ftptest" createuniquename="true" source="BACARGO_C2K" receiver="C2K">
      <displayName>Ftp to file</displayName>
      <createdOn>2007-01-01</createdOn>
      <modifiedOn>2007-01-01</modifiedOn>
      <inBoundEndPoint id="ftpreader_1" endPointType="FTP_READER">
        <uri>ftp://ftp.sunet.se/</uri>
        <clazzname>a classname</clazzname>
        <cron>0/30 * * * * ?</cron>
        <contextparam name="ftpAuthUser" value=""/>
        <contextparam name="ftpAuthPassword" value=""/>
        <contextparam name="ftpPort" value=""/>
        <contextparam name="fileList" value="/pub/pictures/ascii/art07,/pub/pictures/ascii/art08"/>
      </inBoundEndPoint>
      <outBoundEndPoint id="ftp_to_filewriter_1" endPointType="FILE_WRITER">
        <uri>file://temp/grouter/nodes/ftptest/out</uri>
        <clazzname>a classname</clazzname>
        <cron>0/5 * * * * ?</cron>
      </outBoundEndPoint>
    </Node>

    <Node id="filetest2" createuniquename="true" source="FINNAIR" receiver="C2K">
      <description>Another file to file node</description>
      <displayName>FileToFileTest2</displayName>
      <createdOn>2007-01-01</createdOn>
      <modifiedOn>2007-01-01</modifiedOn>
      <backup/>
      <inBoundEndPoint id="filtest1" endPointType="FILE_READER">
        <uri>file://temp/grouter/nodes/filetest2/in</uri>
        <clazzname>a classname</clazzname>
        <cron>0/5 * * * * ?</cron>
      </inBoundEndPoint>
      <outBoundEndPoint id="filtest2" endPointType="FILE_WRITER">
        <uri>file://temp/grouter/nodes/filetest2/out</uri>
        <clazzname>a classname</clazzname>
        <cron>0/5 * * * * ?</cron>
      </outBoundEndPoint>
    </Node>
  </Nodes>

</Grouter>