<?xml version="1.0" encoding="utf-8"?>
<Grouter displayName="router2" description="Test router for jms" id="grouter_id_3"
         rmiRegistryPort="2099" rmiServicePort="2100"
         home="file://temp/grouter"
         xmlns="http://grouter.org/config.xsd"
         xmlns:xsi="http://www.w3.org/2001/XMLSchema-instance"
         xsi:schemaLocation="http://grouter.org/config.xsd ../../../../../../common/common-configbeans/src/main/xsd/config.xsd"
         xsi:noNamespaceSchemaLocation="../../../../../../common/common-configbeans/src/main/xsd/config.xsd">

  <Settings>
    <Jndi>
      <naming.factory.initial>org.jnp.interfaces.NamingContextFactory</naming.factory.initial>
      <naming.provider.url>jnp://localhost:1099</naming.provider.url>
      <naming.factory.url.pkgs>org.jboss.naming:org.jnp.interfaces</naming.factory.url.pkgs>
      <naming.queueconnectionfactoy>UIL2ConnectionFactory</naming.queueconnectionfactoy>
    </Jndi>
    <Logging>
      <jms.loggingQueue>queue/GrouterQueue</jms.loggingQueue>
    </Logging>
  </Settings>


  <Nodes>
    <Node id="jmstest123" createuniquename="true" source="BACARGO_C2K" receiver="C2K">
      <description>Ftp to file</description>
      <createdOn>2007-01-01</createdOn>
      <modifiedOn>2007-01-01</modifiedOn>
      <inBoundEndPoint id="jmsreader_1" endPointType="JMS_READER">
        <uri>jnp://localhost:1099</uri>
        <clazzname>a classname</clazzname>
        <cron>0/10 * * * * ?</cron>
        <!-- for activemq : ConnectionFactory, fo jboss : UIL2ConnectionFactory  -->
        <contextparam name="jms.connectionFactory" value="ConnectionFactory"/>
        <contextparam name="jms.destinationName" value="queue/GrouterQueue"/>
        <contextparam name="jms.isQueue" value="true"/>
        <contextparam name="jndi.contextFactory" value="org.jnp.interfaces.NamingContextFactory"/>
        <!-- Using the uri instead contextparam name="jndi.providerUrl" value="jnp://localhost:1099"/ -->
        <contextparam name="jndi.urlPkgPrefixes" value="org.jboss.naming:org.jnp.interfaces"/>
      </inBoundEndPoint>
      <outBoundEndPoint id="filewriter_1" endPointType="FILE_WRITER">
        <uri>file://temp/grouter/nodes/jmstest/out</uri>
        <clazzname>a classname</clazzname>
        <cron>0/20 * * * * ?</cron>
      </outBoundEndPoint>
    </Node>
  </Nodes>
</Grouter>