<?xml version="1.0" encoding="utf-8"?>
<Grouter displayName="Router 1" id="GR1" rmiRegistryPort="4099" rmiServicePort="4000"
         description="Test router for file nodes"
         home="file://temp/grouter3"
         xmlns="http://grouter.org/config.xsd"
         xmlns:xsi="http://www.w3.org/2001/XMLSchema-instance"
         xsi:schemaLocation="http://grouter.org/config.xsd config.xsd"
         xsi:noNamespaceSchemaLocation="config.xsd">

  <Settings>
    <Jndi>
      <naming.factory.initial>org.jnp.interfaces.NamingContextFactory</naming.factory.initial>
      <naming.provider.url>jnp://localhost:1099</naming.provider.url>
      <naming.factory.url.pkgs>org.jboss.naming:org.jnp.interfaces</naming.factory.url.pkgs>
      <naming.queueconnectionfactoy>UIL2ConnectionFactory</naming.queueconnectionfactoy>
    </Jndi>
    <Logging>
      <jms.loggingQueue>queue/GrouterQueue</jms.loggingQueue>
    </Logging>
     <!-- This overrides datasource set in spring context files -->
    <DataSource>
      <dialect>org.hibernate.dialect.MySQLInnoDBDialect</dialect>
      <driverClassName>org.gjt.mm.mysql.Driver</driverClassName>
      <url>jdbc:mysql://localhost:3306/grouter</url>
      <userName>grouter</userName>
      <password>grouter</password>
    </DataSource>
  </Settings>

  <Jobs>
    <Job id="GR1JO1" jobType="ASSYNCHRONOUS">
      <displayname>A job</displayname>
      <cron>0/10 * * * * ?</cron>
      <contextparam name="ftpAuthUser" value=""/>
      <contextparam name="ftpAuthPassword" value=""/>
      <contextparam name="ftpPort" value=""/>
      <contextparam name="fileList" value="/pub/pictures/ascii/art07,/pub/pictures/ascii/art08"/>
    </Job>
    <Job id="GR1JO2" jobType="SYNCHRONOUS">
      <displayname>Disp name</displayname>
      <cron>* 3 2 2 1</cron>
    </Job>
      <Job id="GR1JO3" jobType="SYNCHRONOUS">
      <displayname>Test 123</displayname>
      <cron>* *  * * *</cron>
    </Job>
  </Jobs>

  <Nodes>
    <Node id="GR1NO1" createuniquename="true" source="BACARGO_C2K" receiver="C2K1" createDirectories="true">
      <description>Test node 1</description>
      <displayName>FileToFileTest_1</displayName>
      <createdOn>2007-01-01</createdOn>
      <backup>
        <overrideDefaultUri>file://temp/grouter3/nodes/GR1NO1/backupoverride</overrideDefaultUri>
      </backup>
      <inBoundEndPoint id="GR1NO1ETIN" endPointType="FILE_READER">
        <uri>file://temp/grouter3/nodes/GR1NO1/in</uri>
        <clazzname>a classname</clazzname>
        <cron>0/5 * * * * ?</cron>
      </inBoundEndPoint>
      <outBoundEndPoint id="GR1NO1ETOUT" endPointType="FILE_WRITER">
        <uri>file://temp/grouter3/nodes/GR1NO1/out</uri>
        <clazzname>a classname</clazzname>
        <cron>0/7 * * * * ?</cron>
      </outBoundEndPoint>
    </Node>

    <Node id="GR1NO2" createuniquename="true" source="FINNAIR" receiver="internal" createDirectories="true">
      <description>Another file to file node</description>
      <displayName>FileToFileTest_2</displayName>
      <createdOn>2007-01-01</createdOn>
      <backup/>
      <inBoundEndPoint id="GR1NO2ETIN" endPointType="FILE_READER">
        <uri>file://temp/grouter3/nodes/GR1NO2/in</uri>
        <clazzname>a classname</clazzname>
        <cron>0/5 * * * * ?</cron>
      </inBoundEndPoint>
      <outBoundEndPoint id="GR1NO2ETOUT" endPointType="FILE_WRITER">
        <uri>file://temp/grouter3/nodes/GR1NO2/out</uri>
        <clazzname>a classname</clazzname>
        <cron>0/5 * * * * ?</cron>
      </outBoundEndPoint>
    </Node>
  </Nodes>
</Grouter>
