<?xml version="1.0" encoding="utf-8"?>
<Grouter displayName="Router 1" id="grouter_id_1" rmiRegistryPort="4099" rmiServicePort="4000"
         description="Test router for file nodes"
         home="file://temp/grouter"
         xmlns="http://grouter.org/config.xsd"
         xmlns:xsi="http://www.w3.org/2001/XMLSchema-instance"
         xsi:schemaLocation="http://grouter.org/config.xsd ../../../../../../common/common-configbeans/src/main/xsd/config.xsd"
         xsi:noNamespaceSchemaLocation="../../../../../../common/common-configbeans/src/main/xsd/config.xsd">

  <Settings>
    <Jndi>
      <naming.factory.initial>org.jnp.interfaces.NamingContextFactory</naming.factory.initial>
      <naming.provider.url>jnp://localhost:1099</naming.provider.url>
      <naming.factory.url.pkgs>org.jboss.naming:org.jnp.interfaces</naming.factory.url.pkgs>
      <naming.queueconnectionfactoy>UIL2ConnectionFactory</naming.queueconnectionfactoy>
    </Jndi>
    <Logging>
      <jms.loggingQueue>queue/GrouterQueue</jms.loggingQueue>
    </Logging>
     <!-- This overrides datasource set in spring context files -->
    <DataSource>
      <dialect>org.hibernate.dialect.MySQLInnoDBDialect</dialect>
      <driverClassName>org.gjt.mm.mysql.Driver</driverClassName>
      <url>jdbc:mysql://localhost:3306/grouter</url>
      <userName>grouter</userName>
      <password>grouter</password>
    </DataSource>
  </Settings>

  <GlobalJobs>
    <Job idno="backuphandler" jobType="ARCHIVER">
      <displayname></displayname>
      <cron>0/10 * * * * ?</cron>
      <contextparam name="ftpAuthUser" value=""/>
      <contextparam name="ftpAuthPassword" value=""/>
      <contextparam name="ftpPort" value=""/>
      <contextparam name="fileList" value="/pub/pictures/ascii/art07,/pub/pictures/ascii/art08"/>
    </Job>
    <Job idno="1s23" jobType="ARCHIVER">
      <displayname></displayname>
      <cron></cron>
    </Job>
  </GlobalJobs>

  <Nodes>
    <Node id="filetest" createuniquename="true" source="BACARGO_C2K" receiver="C2K1" createDirectories="true">
      <description>Test node 1</description>
      <displayName>FileToFileTest_1</displayName>
      <createdOn>2007-01-01</createdOn>
      <backup>
        <overrideDefaultUri>file://temp/grouter/nodes/filetest/backupoverride</overrideDefaultUri>
      </backup>
      <inBoundEndPoint id="filereader_1" endPointType="FILE_READER">
        <uri>file://temp/grouter/nodes/filetest/in</uri>
        <clazzname>a classname</clazzname>
        <cron>0/5 * * * * ?</cron>
      </inBoundEndPoint>
      <outBoundEndPoint id="filewriter_1" endPointType="FILE_WRITER">
        <uri>file://temp/grouter/nodes/filetest/out</uri>
        <clazzname>a classname</clazzname>
        <cron>0/7 * * * * ?</cron>
      </outBoundEndPoint>
    </Node>

    <Node id="filetest2" createuniquename="true" source="FINNAIR" receiver="internal" createDirectories="true">
      <description>Another file to file node</description>
      <displayName>FileToFileTest_2</displayName>
      <createdOn>2007-01-01</createdOn>
      <backup/>
      <inBoundEndPoint id="filtest12_reader" endPointType="FILE_READER">
        <uri>file://temp/grouter/nodes/filetest2/in</uri>
        <clazzname>a classname</clazzname>
        <cron>0/5 * * * * ?</cron>
      </inBoundEndPoint>
      <outBoundEndPoint id="filtest2_reader" endPointType="FILE_WRITER">
        <uri>file://temp/grouter/nodes/filetest2/out</uri>
        <clazzname>a classname</clazzname>
        <cron>0/5 * * * * ?</cron>
      </outBoundEndPoint>
    </Node>
  </Nodes>
</Grouter>